{
  "schema_version": "2.0",
  "id": "11137_nouhau",
  "headword": "ノウハウ",
  "reading": "のうはう",
  "part_of_speech": "noun",
  "gloss": "know-how, expertise",
  "definitions": [
    {
      "sense_number": 1,
      "gloss": "know-how, expertise, practical knowledge",
      "explanation": "Practical knowledge and skill acquired through experience, especially regarding how to accomplish specific tasks or achieve results."
    }
  ],
  "examples": [
    {
      "id": "11137_nouhau_ex1",
      "japanese": "ノウハウ⟦を→を：00422_wo⟧⟦{蓄積|ちくせき}する→蓄積する：25358_chikusekisuru⟧。",
      "english": "Accumulate know-how.",
      "notes": null,
      "has_audio": true,
      "sense_numbers": [
        1
      ]
    },
    {
      "id": "11137_nouhau_ex2",
      "japanese": "⟦{長年|ながねん}→長年：09684_naganen⟧⟦の→の：09472_no⟧ノウハウ⟦が→が：00051_ga⟧⟦{強|つよ}み→強み：12499_tsuyomi⟧になっている。",
      "english": "Years of know-how have become a strength.",
      "notes": null,
      "has_audio": true,
      "sense_numbers": [
        1
      ]
    },
    {
      "id": "11137_nouhau_ex3",
      "japanese": "⟦{海外|かいがい}→海外：00134_kaigai⟧⟦{進出|しんしゅつ}→進出：14387_shinshutsu⟧⟦の→の：09472_no⟧ノウハウ⟦を→を：00422_wo⟧⟦{持|も}っている→持つ：00478_motsu⟧⟦{企業|きぎょう}→企業：00225_kigyou⟧⟦と→と：00512_to⟧⟦{提携|ていけい}→提携：05773_teikei⟧⟦したい→する：00392_suru⟧。",
      "english": "We want to partner with a company that has expertise in overseas expansion.",
      "notes": null,
      "has_audio": true,
      "sense_numbers": [
        1
      ]
    }
  ],
  "notes": "USAGE:\nCommonly used in business contexts. Refers to practical, experiential knowledge rather than theoretical knowledge. Often implies something valuable that has been built up over time.\n\nCOMMON COLLOCATIONS:\n- ノウハウ⟦を→を：00422_wo⟧⟦{蓄積|ちくせき}する→蓄積する：25358_chikusekisuru⟧ (accumulate know-how)\n- ノウハウ⟦を→を：00422_wo⟧⟦{共有|きょうゆう}する→共有する：19639_kyouyuusuru⟧ (share know-how)\n- ノウハウ⟦を→を：00422_wo⟧⟦{活|い}かす→活かす：10422_ikasu⟧ (leverage know-how)\n- ノウハウ⟦を→を：00422_wo⟧⟦{伝|つた}える→伝える：01220_tsutaeru⟧ (pass on know-how)\n- ⟦{営業|えいぎょう}→営業：01878_eigyou⟧ノウハウ (sales know-how)\n- ⟦{技術|ぎじゅつ}→技術：01389_gijutsu⟧ノウハウ (technical know-how)\n\nETYMOLOGY:\nFrom English \"know-how.\"",
  "cross_references": [],
  "metadata": {
    "created": "2026-02-14T03:15:22Z",
    "modified": "2026-10-13T00:43:37Z",
    "ai_model": "claude-opus-4-6",
    "vocabulary_tier": "general",
    "tags": {
      "pos": [
        "noun"
      ],
      "formality": "neutral",
      "politeness": "plain",
      "domain": [
        "business"
      ],
      "semantic": [
        "business",
        "cognition"
      ]
    }
  }
}
