{
  "id": "16315_kokorozuyoi",
  "headword": "{心強|こころづよ}い",
  "reading": "こころづよい",
  "part_of_speech": "i-adjective",
  "gloss": "reassuring, encouraging",
  "definitions": [
    {
      "sense_number": 1,
      "gloss": "reassuring, encouraging, heartening",
      "explanation": "Feeling reassured or emboldened by having reliable support, a capable ally, or favorable circumstances."
    }
  ],
  "examples": [
    {
      "id": "16315_kokorozuyoi_ex1",
      "japanese": "⟦{味方|みかた}→味方：03743_mikata⟧⟦が→が：00051_ga⟧⟦いる→いる：00495_iru⟧⟦と→と：00512_to⟧{心強|こころづよ}い。",
      "english": "It's reassuring to have an ally.",
      "notes": null,
      "has_audio": true,
      "sense_numbers": [
        1
      ]
    },
    {
      "id": "16315_kokorozuyoi_ex2",
      "japanese": "⟦{経験者|けいけんしゃ}→経験者：18664_keikensha⟧がいて⟦くれて→くれる：00724_kureru⟧{心強|こころづよ}かった。",
      "english": "It was reassuring to have an experienced person with us.",
      "notes": null,
      "has_audio": true,
      "sense_numbers": [
        1
      ]
    },
    {
      "id": "16315_kokorozuyoi_ex3",
      "japanese": "⟦{先輩|せんぱい}→先輩：01451_senpai⟧⟦の→の：09472_no⟧⟦{応援|おうえん}→応援：01900_ouen⟧⟦は→は：00079_ha⟧⟦{何|なに}→何：00498_nani⟧⟦より→より：09476_yori⟧⟦も→も：00484_mo⟧{心強|こころづよ}い⟦{存在|そんざい}→存在：03326_sonzai⟧だった。",
      "english": "My senior's support was the most reassuring presence of all.",
      "notes": null,
      "has_audio": true,
      "sense_numbers": [
        1
      ]
    }
  ],
  "notes": "USAGE:\n{心強|こころづよ}い describes the feeling of being reassured or encouraged by someone or something reliable. It is often used when you have a dependable person on your side.\n\nCOMMON PATTERNS:\n- 〜⟦が→が：00051_ga⟧⟦いる→いる：00495_iru⟧⟦と→と：00512_to⟧{心強|こころづよ}い: it's reassuring to have ~\n- 〜て⟦くれて→くれる：00724_kureru⟧{心強|こころづよ}い: reassuring that ~ did (something for me)\n- {心強|こころづよ}い⟦{味方|みかた}→味方：03743_mikata⟧: a reassuring ally\n\nSIMILAR WORDS:\n- ⟦{心細|こころぼそ}い→心細い：19516_kokorobosoi⟧: anxious, uneasy, lonely (feeling unsupported)",
  "cross_references": [
    {
      "type": "antonym",
      "target_id": "19516_kokorobosoi",
      "reading": "こころぼそい",
      "headword": "{心細|こころぼそ}い",
      "label": "anxious, uneasy"
    },
    {
      "type": "contrast",
      "target_id": "20294_tayorininaru",
      "reading": "たよりになる",
      "headword": "{頼|たよ}りになる",
      "label": "reliable"
    }
  ],
  "metadata": {
    "created": "2026-03-12T01:20:22Z",
    "modified": "2026-09-02T04:01:44Z",
    "vocabulary_tier": "general",
    "tags": {
      "pos": [
        "adjective-i"
      ],
      "formality": "neutral",
      "politeness": "plain",
      "semantic": [
        "emotion"
      ]
    }
  },
  "schema_version": "2.0",
  "conjugation": {
    "type": "i-adjective",
    "forms": [
      {
        "label": "Present",
        "affirmative": "{心強|こころづよ}い",
        "negative": "{心強|こころづよ}くない"
      },
      {
        "label": "Past",
        "affirmative": "{心強|こころづよ}かった",
        "negative": "{心強|こころづよ}くなかった"
      },
      {
        "label": "て form",
        "affirmative": "{心強|こころづよ}くて",
        "negative": "{心強|こころづよ}くなくて"
      },
      {
        "label": "Adverbial",
        "affirmative": "{心強|こころづよ}く",
        "negative": null
      },
      {
        "label": "Conditional ば",
        "affirmative": "{心強|こころづよ}ければ",
        "negative": "{心強|こころづよ}くなければ"
      },
      {
        "label": "Conditional たら",
        "affirmative": "{心強|こころづよ}かったら",
        "negative": "{心強|こころづよ}くなかったら"
      }
    ]
  }
}
