{
  "id": "05152_webusaito",
  "headword": "ウェブサイト",
  "reading": "うぇぶさいと",
  "part_of_speech": "noun",
  "gloss": "website",
  "definitions": [
    {
      "sense_number": 1,
      "gloss": "website",
      "explanation": "A collection of web pages accessible via the internet, typically identified by a common domain name."
    }
  ],
  "examples": [
    {
      "id": "05152_webusaito_ex1",
      "japanese": "ウェブサイト⟦を→を：00422_wo⟧⟦{作|つく}る→作る：00481_tsukuru⟧。",
      "english": "To create a website.",
      "notes": null,
      "has_audio": true,
      "sense_numbers": [
        1
      ]
    },
    {
      "id": "05152_webusaito_ex2",
      "japanese": "⟦{会社|かいしゃ}→会社：00607_kaisha⟧⟦の→の：09472_no⟧ウェブサイト⟦を→を：00422_wo⟧⟦{見|み}てください→見る：00283_miru⟧。",
      "english": "Please look at the company's website.",
      "notes": null,
      "has_audio": true,
      "sense_numbers": [
        1
      ]
    },
    {
      "id": "05152_webusaito_ex3",
      "japanese": "⟦その→その：00993_sono⟧ウェブサイト⟦は→は：00079_ha⟧⟦{長|なが}い→長い：00491_nagai⟧⟦{間|あいだ}→間：00914_aida⟧⟦{更新|こうしん}されていない→更新する：27994_koushinsuru⟧⟦ようだ→ようだ：26593_youda⟧。",
      "english": "That website doesn't seem to have been updated in a long time.",
      "notes": null,
      "has_audio": true,
      "sense_numbers": [
        1
      ]
    }
  ],
  "notes": "ウェブサイト is a direct loanword from English \"website.\" In everyday Japanese, it is often shortened to ⟦サイト→サイト：05603_saito⟧.\n\nFORMS:\n- ⟦サイト→サイト：05603_saito⟧: shortened form, very common in casual use\n- ⟦ホームページ→ホームページ：05869_hoomupeeji⟧: in Japanese, this often means \"website\" (not just the home page), especially among older speakers\n\nCOMMON COLLOCATIONS:\n- ウェブサイト⟦を→を：00422_wo⟧⟦{作成|さくせい}する→作成する：25378_sakuseisuru⟧: to create a website\n- ウェブサイト⟦を→を：00422_wo⟧⟦{閲覧|えつらん}する→閲覧する：18280_etsuransuru⟧: to browse a website\n- ⟦{公式|こうしき}→公式：04167_koushiki⟧ウェブサイト: official website\n- ウェブサイト⟦を→を：00422_wo⟧⟦{更新|こうしん}する→更新する：27994_koushinsuru⟧: to update a website\n\nUSAGE:\nウェブサイト sounds slightly more formal or precise than ⟦サイト→サイト：05603_saito⟧. In spoken Japanese, ⟦サイト→サイト：05603_saito⟧ is more common. ⟦ホームページ→ホームページ：05869_hoomupeeji⟧ is still widely used, especially in business and by non-technical speakers.",
  "cross_references": [
    {
      "type": "synonym",
      "target_id": "05603_saito",
      "reading": "さいと",
      "headword": "サイト",
      "label": "shortened form"
    },
    {
      "type": "synonym",
      "target_id": "05869_hoomupeeji",
      "reading": "ほーむぺーじ",
      "headword": "ホームページ",
      "label": "website (older usage)"
    },
    {
      "type": "related",
      "target_id": "04723_intaanetto",
      "reading": "いんたーねっと",
      "headword": "インターネット",
      "label": "internet"
    },
    {
      "type": "related",
      "target_id": "08902_eichipii",
      "reading": "えいちぴー",
      "headword": "HP",
      "label": "homepage, website"
    },
    {
      "type": "contrast",
      "target_id": "23834_webupeeji",
      "reading": "うぇぶぺーじ",
      "headword": "ウェブページ",
      "label": "web page"
    }
  ],
  "metadata": {
    "created": "2026-01-16T02:32:54Z",
    "modified": "2026-10-05T02:10:49Z",
    "ai_model": "claude-opus-4-5",
    "vocabulary_tier": "general",
    "tags": {
      "pos": [
        "noun"
      ],
      "domain": [
        "internet"
      ],
      "formality": "neutral",
      "politeness": "plain",
      "semantic": [
        "electronics"
      ]
    }
  }
}