{
  "schema_version": "2.0",
  "id": "13808_mokushi",
  "headword": "{目視|もくし}",
  "reading": "もくし",
  "part_of_speech": "noun, suru verb",
  "gloss": "visual inspection, looking with the naked eye",
  "conjugation": {
    "type": "suru",
    "forms": [
      {
        "label": "Present",
        "affirmative": "{目視|もくし}する",
        "negative": "{目視|もくし}しない"
      },
      {
        "label": "Present polite",
        "affirmative": "{目視|もくし}します",
        "negative": "{目視|もくし}しません"
      },
      {
        "label": "Past",
        "affirmative": "{目視|もくし}した",
        "negative": "{目視|もくし}しなかった"
      },
      {
        "label": "Past polite",
        "affirmative": "{目視|もくし}しました",
        "negative": "{目視|もくし}しませんでした"
      },
      {
        "label": "て form",
        "affirmative": "{目視|もくし}して",
        "negative": "{目視|もくし}しなくて"
      },
      {
        "label": "ている present",
        "affirmative": "{目視|もくし}している",
        "negative": "{目視|もくし}していない"
      },
      {
        "label": "ている polite",
        "affirmative": "{目視|もくし}しています",
        "negative": "{目視|もくし}していません"
      },
      {
        "label": "ている past",
        "affirmative": "{目視|もくし}していた",
        "negative": "{目視|もくし}していなかった"
      },
      {
        "label": "ている past polite",
        "affirmative": "{目視|もくし}していました",
        "negative": "{目視|もくし}していませんでした"
      },
      {
        "label": "Conditional ば",
        "affirmative": "{目視|もくし}すれば",
        "negative": "{目視|もくし}しなければ"
      },
      {
        "label": "Conditional たら",
        "affirmative": "{目視|もくし}したら",
        "negative": "{目視|もくし}しなかったら"
      },
      {
        "label": "Volitional",
        "affirmative": "{目視|もくし}しよう",
        "negative": null
      },
      {
        "label": "Volitional polite",
        "affirmative": "{目視|もくし}しましょう",
        "negative": null
      },
      {
        "label": "Potential",
        "affirmative": "{目視|もくし}できる",
        "negative": "{目視|もくし}できない"
      },
      {
        "label": "Passive",
        "affirmative": "{目視|もくし}される",
        "negative": "{目視|もくし}されない"
      },
      {
        "label": "Causative",
        "affirmative": "{目視|もくし}させる",
        "negative": "{目視|もくし}させない"
      },
      {
        "label": "Imperative",
        "affirmative": "{目視|もくし}しろ",
        "negative": "{目視|もくし}するな"
      }
    ]
  },
  "definitions": [
    {
      "sense_number": 1,
      "gloss": "visual inspection, visual check, looking with the naked eye",
      "explanation": "The act of checking or confirming something by looking at it directly with one's own eyes, as opposed to using instruments or automated systems."
    }
  ],
  "examples": [
    {
      "id": "13808_mokushi_ex1",
      "japanese": "{目視|もくし}⟦で→で：00502_de⟧⟦{確認|かくにん}する→確認する：25332_kakuninsuru⟧。",
      "english": "To confirm by visual inspection.",
      "notes": null,
      "has_audio": true,
      "sense_numbers": [
        1
      ]
    },
    {
      "id": "13808_mokushi_ex2",
      "japanese": "⟦{安全|あんぜん}→安全：01131_anzen⟧⟦{確認|かくにん}→確認：00158_kakunin⟧⟦は→は：00079_ha⟧⟦{必|かなら}ず→必ず：01249_kanarazu⟧{目視|もくし}⟦で→で：00502_de⟧⟦{行|おこな}って→行う：01238_okonau⟧⟦ください→下さい：02899_kudasai⟧。",
      "english": "Please always perform safety checks visually.",
      "notes": null,
      "has_audio": true,
      "sense_numbers": [
        1
      ]
    },
    {
      "id": "13808_mokushi_ex3",
      "japanese": "⟦{計器|けいき}→計器：03946_keiki⟧⟦だけでなく→〜だけでなく：18373_dakedenaku⟧{目視|もくし}⟦で→で：00502_de⟧⟦も→も：00484_mo⟧⟦{異常|いじょう}→異常：01716_ijou⟧⟦が→が：00051_ga⟧⟦ない→ない：01118_nai⟧⟦か→か：09473_ka⟧⟦{点検|てんけん}→点検：09765_tenken⟧⟦した→する：00392_suru⟧。",
      "english": "I inspected not only with instruments but also visually for any abnormalities.",
      "notes": null,
      "has_audio": true,
      "sense_numbers": [
        1
      ]
    }
  ],
  "notes": "USAGE:\nA formal, technical term used as a suru verb: {目視|もくし}⟦する→する：00392_suru⟧ (to visually inspect). Common in workplace safety, aviation, manufacturing, and quality control contexts. Often contrasted with instrumental or automated checks.\n\nCOMMON COLLOCATIONS:\n- {目視|もくし}⟦{確認|かくにん}→確認：00158_kakunin⟧: visual confirmation\n- {目視|もくし}⟦{検査|けんさ}→検査：02707_kensa⟧: visual inspection\n- {目視|もくし}⟦{点検|てんけん}→点検：09765_tenken⟧: visual check\n- {目視|もくし}⟦で→で：00502_de⟧⟦{確認|かくにん}する→確認する：25332_kakuninsuru⟧: to verify visually",
  "cross_references": [],
  "metadata": {
    "created": "2026-02-27T04:17:12Z",
    "modified": "2026-09-25T06:18:39Z",
    "ai_model": "claude-opus-4-6",
    "vocabulary_tier": "general",
    "tags": {
      "pos": [
        "noun",
        "verb-suru"
      ],
      "formality": "formal",
      "politeness": "plain",
      "semantic": [
        "cognition"
      ],
      "domain": [
        "technical"
      ],
      "verb_class": "suru",
      "transitivity": "transitive"
    }
  }
}
