{
  "id": "06361_kaiwai",
  "headword": "{界隈|かいわい}",
  "reading": "かいわい",
  "part_of_speech": "noun",
  "gloss": "neighborhood; community; scene; fandom",
  "definitions": [
    {
      "sense_number": 1,
      "gloss": "neighborhood, vicinity, area",
      "explanation": "A geographical area or neighborhood, typically referring to the surroundings of a specific location."
    },
    {
      "sense_number": 2,
      "gloss": "community, scene, fandom",
      "explanation": "A group of people with shared interests, particularly used online to refer to fan communities or subcultures. Modern slang usage."
    }
  ],
  "examples": [
    {
      "id": "06361_kaiwai_ex1",
      "japanese": "{駅|えき}{界隈|かいわい}には{飲食店|いんしょくてん}が{多|おお}い。",
      "english": "There are many restaurants in the area around the station.",
      "has_audio": false,
      "sense_numbers": [
        1
      ]
    },
    {
      "id": "06361_kaiwai_ex2",
      "japanese": "あの{界隈|かいわい}では{有名|ゆうめい}な{人|ひと}だ。",
      "english": "They're famous in that community.",
      "has_audio": false,
      "sense_numbers": [
        2
      ]
    },
    {
      "id": "06361_kaiwai_ex3",
      "japanese": "アニメ{界隈|かいわい}で{話題|わだい}になっている。",
      "english": "It's become a hot topic in the anime community.",
      "has_audio": false,
      "sense_numbers": [
        2
      ]
    },
    {
      "id": "06361_kaiwai_ex4",
      "japanese": "{推|お}し{活|かつ}{界隈|かいわい}の{人|ひと}たちと{繋|つな}がった。",
      "english": "I connected with people in the idol fan community.",
      "notes": "{推|お}し{活|かつ} = supporting one's favorite idol",
      "has_audio": false,
      "sense_numbers": [
        2
      ]
    }
  ],
  "notes": "REGISTER: Neutral in sense 1; casual/slang in sense 2.\n\nTRADITIONAL USAGE (sense 1):\nThe original meaning refers to a geographical area or neighborhood, as in {銀座|ぎんざ}{界隈|かいわい} (the Ginza area).\n\nMODERN SLANG (sense 2):\nSince the 2010s, {界隈|かいわい} has become popular online to refer to communities based on shared interests:\n- ゲーム{界隈|かいわい}: gaming community\n- コスプレ{界隈|かいわい}: cosplay community\n- Vtuber{界隈|かいわい}: VTuber fandom\n\nRELATED EXPRESSIONS:\n- {界隈|かいわい}{民|たみ}: members of a community\n- 〜{界隈|かいわい}で{炎上|えんじょう}: to cause controversy in a community\n\nNOTE: In online contexts, {界隈|かいわい} can sometimes have slightly negative connotations, implying an insular or drama-prone community.",
  "metadata": {
    "created": "2026-01-17T08:41:56Z",
    "modified": "2026-01-17T08:41:56Z",
    "ai_model": "claude-opus-4-5",
    "vocabulary_tier": null
  }
}