{
  "id": "09947_shuushin",
  "headword": "{就寝|しゅうしん}",
  "reading": "しゅうしん",
  "part_of_speech": "noun, suru verb",
  "gloss": "going to bed; retiring for the night",
  "conjugation": {
    "type": "suru",
    "forms": [
      {
        "label": "Present",
        "affirmative": "{就寝|しゅうしん}する",
        "negative": "{就寝|しゅうしん}しない"
      },
      {
        "label": "Present polite",
        "affirmative": "{就寝|しゅうしん}します",
        "negative": "{就寝|しゅうしん}しません"
      },
      {
        "label": "Past",
        "affirmative": "{就寝|しゅうしん}した",
        "negative": "{就寝|しゅうしん}しなかった"
      },
      {
        "label": "Past polite",
        "affirmative": "{就寝|しゅうしん}しました",
        "negative": "{就寝|しゅうしん}しませんでした"
      },
      {
        "label": "て form",
        "affirmative": "{就寝|しゅうしん}して",
        "negative": "{就寝|しゅうしん}しなくて"
      },
      {
        "label": "ている present",
        "affirmative": "{就寝|しゅうしん}している",
        "negative": "{就寝|しゅうしん}していない"
      },
      {
        "label": "ている polite",
        "affirmative": "{就寝|しゅうしん}しています",
        "negative": "{就寝|しゅうしん}していません"
      },
      {
        "label": "ている past",
        "affirmative": "{就寝|しゅうしん}していた",
        "negative": "{就寝|しゅうしん}していなかった"
      },
      {
        "label": "ている past polite",
        "affirmative": "{就寝|しゅうしん}していました",
        "negative": "{就寝|しゅうしん}していませんでした"
      },
      {
        "label": "Conditional ば",
        "affirmative": "{就寝|しゅうしん}すれば",
        "negative": "{就寝|しゅうしん}しなければ"
      },
      {
        "label": "Conditional たら",
        "affirmative": "{就寝|しゅうしん}したら",
        "negative": "{就寝|しゅうしん}しなかったら"
      },
      {
        "label": "Volitional",
        "affirmative": "{就寝|しゅうしん}しよう",
        "negative": null
      },
      {
        "label": "Volitional polite",
        "affirmative": "{就寝|しゅうしん}しましょう",
        "negative": null
      },
      {
        "label": "Potential",
        "affirmative": "{就寝|しゅうしん}できる",
        "negative": "{就寝|しゅうしん}できない"
      },
      {
        "label": "Passive",
        "affirmative": "{就寝|しゅうしん}される",
        "negative": "{就寝|しゅうしん}されない"
      },
      {
        "label": "Causative",
        "affirmative": "{就寝|しゅうしん}させる",
        "negative": "{就寝|しゅうしん}させない"
      },
      {
        "label": "Imperative",
        "affirmative": "{就寝|しゅうしん}しろ",
        "negative": "{就寝|しゅうしん}するな"
      }
    ]
  },
  "definitions": [
    {
      "sense_number": 1,
      "gloss": "going to bed; retiring for the night",
      "explanation": "The act of going to sleep, often used in formal or institutional contexts."
    }
  ],
  "examples": [
    {
      "id": "09947_shuushin_ex1",
      "japanese": "{就寝|しゅうしん}⟦{時間|じかん}→時間：00468_jikan⟧⟦は→は：00079_ha⟧10⟦{時|じ}→時：09869_ji⟧です。",
      "english": "Bedtime is 10 o'clock.",
      "notes": null,
      "has_audio": true,
      "sense_numbers": [
        1
      ]
    },
    {
      "id": "09947_shuushin_ex2",
      "japanese": "{就寝|しゅうしん}⟦{前|まえ}→前：02255_mae⟧⟦に→に：00314_ni⟧⟦スマホ→スマホ：04721_sumaho⟧⟦を→を：00422_wo⟧⟦{見|み}ない→見る：00283_miru⟧。",
      "english": "I don't look at my smartphone before bed.",
      "notes": null,
      "has_audio": true,
      "sense_numbers": [
        1
      ]
    },
    {
      "id": "09947_shuushin_ex3",
      "japanese": "⟦{学校|がっこう}→学校：00055_gakkou⟧⟦の→の：09472_no⟧⟦{規則|きそく}→規則：01382_kisoku⟧⟦で→で：00502_de⟧⟦は→は：00079_ha⟧⟦{起床|きしょう}→起床：00237_kishou⟧⟦は→は：00079_ha⟧6⟦{時|じ}→時：09869_ji⟧、{就寝|しゅうしん}⟦は→は：00079_ha⟧10⟦{時|じ}→時：09869_ji⟧だ。",
      "english": "According to school rules, wake-up time is 6 o'clock and bedtime is 10 o'clock.",
      "notes": null,
      "has_audio": true,
      "sense_numbers": [
        1
      ]
    }
  ],
  "notes": "{就寝|しゅうしん} is a formal word for going to bed or retiring for the night. It is more commonly seen in written language, schedules, and institutional settings than in casual conversation.\n\nETYMOLOGY:\n{就|しゅう} (to take up, to settle into) + {寝|しん} (sleep).\n\nCOMPOUNDS:\n- {就寝|しゅうしん}⟦{時間|じかん}→時間：00468_jikan⟧: bedtime\n- {就寝|しゅうしん}⟦{前|まえ}→前：02255_mae⟧: before bed\n- {就寝|しゅうしん}⟦{中|ちゅう}→〜中：09840_chuu⟧: while sleeping\n\nSIMILAR WORDS:\n- ⟦{寝|ね}る→寝る：00470_neru⟧: to sleep, to go to bed (everyday)\n- ⟦{起床|きしょう}→起床：00237_kishou⟧: waking up, getting up (formal opposite)\n\nREGISTER:\nUsed in schedules (⟦{起床|きしょう}→起床：00237_kishou⟧6⟦{時|じ}→時：09869_ji⟧、{就寝|しゅうしん}10⟦{時|じ}→時：09869_ji⟧), hotel and dormitory rules, health advice articles, and formal writing. In conversation, ⟦{寝|ね}る→寝る：00470_neru⟧ is the natural choice.",
  "cross_references": [
    {
      "type": "antonym",
      "target_id": "00237_kishou",
      "reading": "きしょう",
      "headword": "{起床|きしょう}",
      "label": "waking up"
    },
    {
      "type": "contrast",
      "target_id": "00470_neru",
      "reading": "ねる",
      "headword": "{寝|ね}る",
      "label": "to sleep, to go to bed"
    },
    {
      "type": "contrast",
      "target_id": "20594_nyuumin",
      "reading": "にゅうみん",
      "headword": "{入眠|にゅうみん}",
      "label": "falling asleep"
    }
  ],
  "metadata": {
    "created": "2026-02-04T10:52:33Z",
    "modified": "2026-10-05T18:22:13Z",
    "ai_model": "claude-opus-4-5",
    "vocabulary_tier": "general",
    "tags": {
      "pos": [
        "noun",
        "verb-suru"
      ],
      "formality": "formal",
      "politeness": "plain",
      "semantic": [
        "daily-life",
        "time-general"
      ],
      "verb_class": "suru",
      "transitivity": "intransitive"
    }
  }
}
