{
  "id": "05853_pakupaku",
  "headword": "ぱくぱく",
  "reading": "ぱくぱく",
  "part_of_speech": "adverb, onomatopoeia",
  "gloss": "munching; gobbling; opening and closing (mouth)",
  "definitions": [
    {
      "sense_number": 1,
      "gloss": "munching; gobbling",
      "explanation": "Eating eagerly by repeatedly opening and closing the mouth; wolfing down food."
    },
    {
      "sense_number": 2,
      "gloss": "opening and closing repeatedly",
      "explanation": "The motion of a mouth (or mouth-like thing) repeatedly opening and closing."
    }
  ],
  "examples": [
    {
      "id": "05853_pakupaku_ex1",
      "japanese": "{子|こ}どもがケーキをぱくぱく{食|た}べた。",
      "english": "The child gobbled up the cake.",
      "has_audio": false,
      "sense_numbers": [
        1
      ]
    },
    {
      "id": "05853_pakupaku_ex2",
      "japanese": "{金魚|きんぎょ}がぱくぱく{口|くち}を{開|あ}けている。",
      "english": "The goldfish is opening and closing its mouth.",
      "has_audio": false,
      "sense_numbers": [
        2
      ]
    },
    {
      "id": "05853_pakupaku_ex3",
      "japanese": "おにぎりをぱくぱく{頬張|ほおば}る。",
      "english": "To stuff one's cheeks with rice balls.",
      "has_audio": false,
      "sense_numbers": [
        1
      ]
    }
  ],
  "notes": "SOUND REPRESENTATION:\nThe voiceless \"ぱ\" suggests light, quick movements of the mouth, giving a cute or childlike impression.\n\nCOMMON COLLOCATIONS:\n- ぱくぱく{食|た}べる: to munch, gobble\n- {口|くち}をぱくぱく: opening and closing mouth\n- ぱくぱく{頬張|ほおば}る: to stuff one's cheeks\n\nRELATED WORDS:\n- もぐもぐ: chewing (mouth closed)\n- がつがつ: eating greedily (rougher image)\n- ぱくっと: taking one big bite",
  "cross_references": [
    {
      "type": "related",
      "reading": "もぐもぐ",
      "headword": "もぐもぐ",
      "label": "munching",
      "target_id": "05879_mogumogu"
    }
  ],
  "metadata": {
    "created": "2026-01-16T09:41:09Z",
    "modified": "2026-01-18T09:21:26Z",
    "ai_model": "claude-opus-4-5",
    "vocabulary_tier": "core"
  }
}
