{
  "id": "08607_kurasugae",
  "headword": "クラス{替|が}え",
  "reading": "くらすがえ",
  "part_of_speech": "noun",
  "gloss": "class reshuffling; changing classes",
  "definitions": [
    {
      "sense_number": 1,
      "gloss": "class reshuffling; reassigning students to new classes",
      "explanation": "the practice of reorganizing students into different homeroom classes, typically done at the beginning of a new school year"
    }
  ],
  "examples": [
    {
      "id": "08607_kurasugae_ex1",
      "japanese": "クラス{替|が}え⟦で→で：00502_de⟧⟦{友達|ともだち}→友達：01478_tomodachi⟧⟦と→と：00512_to⟧⟦{離|はな}れた→離れる：02397_hanareru⟧。",
      "english": "I was separated from my friends after the class reshuffling.",
      "sense_numbers": [
        1
      ],
      "has_audio": true,
      "notes": null
    },
    {
      "id": "08607_kurasugae_ex2",
      "japanese": "⟦{新学年|しんがくねん}→新学年：21402_shingakunen⟧⟦の→の：09472_no⟧クラス{替|が}え⟦が→が：00051_ga⟧⟦{楽|たの}しみ→楽しみ：01651_tanoshimi⟧だ。",
      "english": "I'm looking forward to the class change in the new school year.",
      "sense_numbers": [
        1
      ],
      "has_audio": true,
      "notes": null
    },
    {
      "id": "08607_kurasugae_ex3",
      "japanese": "クラス{替|が}え⟦で→で：00502_de⟧⟦{好|す}き→好き：02355_suki⟧な⟦{子|こ}→子：09851_ko⟧⟦と→と：00512_to⟧⟦{同|おな}じ→同じ：02857_onaji⟧⟦クラス→クラス：01084_kurasu⟧⟦に→に：00314_ni⟧⟦なれ→なる：01970_naru⟧た。",
      "english": "After the class reshuffling, I ended up in the same class as my crush.",
      "sense_numbers": [
        1
      ],
      "has_audio": true,
      "notes": null
    }
  ],
  "notes": "USAGE:\nMost schools reshuffle homeroom classes at the start of the school year in April, some every year and some every two years. Because students spend the whole year with the same class, the announcement is a big moment for them.\n\nSIMILAR WORDS:\n- ⟦{席替|せきが}え→席替え：29987_sekigae⟧: changing seats within one class\n- {組替|くみが}え: an older word for the same reshuffling",
  "cross_references": [
    {
      "type": "related",
      "target_id": "29987_sekigae",
      "reading": "せきがえ",
      "headword": "{席替|せきが}え",
      "label": "desk/seat change"
    },
    {
      "type": "related",
      "target_id": "16408_tannin",
      "reading": "たんにん",
      "headword": "{担任|たんにん}",
      "label": "homeroom teacher"
    },
    {
      "type": "related",
      "target_id": "16070_shingakki",
      "reading": "しんがっき",
      "headword": "{新学期|しんがっき}",
      "label": "new term"
    },
    {
      "type": "contrast",
      "target_id": "31088_kumigae",
      "reading": "くみがえ",
      "headword": "{組替|くみが}え",
      "label": "class reshuffling"
    }
  ],
  "metadata": {
    "vocabulary_tier": "general",
    "tags": {
      "pos": [
        "noun"
      ],
      "formality": "neutral",
      "politeness": "plain",
      "semantic": [
        "education"
      ]
    },
    "created": "2026-01-27T12:31:57Z",
    "modified": "2026-09-27T17:27:46Z"
  }
}
